周扬/week08/不同数据集测试效果/文本匹配项目/其他数据集试验/bq_corpus集/biencoder_cosine_log.json

[
  {
    "epoch": 1,
    "train_loss": 0.2744424653291702,
    "val_acc": 0.7566380932469161,
    "val_f1": 0.7562096971217217,
    "threshold": 0.64,
    "elapsed_s": 662.1616237163544
  },
  {
    "epoch": 2,
    "train_loss": 0.2179757177233696,
    "val_acc": 0.7796362115826887,
    "val_f1": 0.7796260391679061,
    "threshold": 0.68,
    "elapsed_s": 527.1184170246124
  },
  {
    "epoch": 3,
    "train_loss": 0.20167540924549102,
    "val_acc": 0.7865356470834205,
    "val_f1": 0.7865026104177275,
    "threshold": 0.6900000000000001,
    "elapsed_s": 511.5322062969208
  }
]

周扬/week08/不同数据集测试效果/文本匹配项目/其他数据集试验/bq_corpus集/BiEncoder-样本训练.md

# 训练过程

构建模型...
Loading weights: 100%|█████████████████████████| 55/55 [00:00<00:00, 14495.84it/s]
模型: BiEncoder (pool=mean, layers=3)
参数量: 38.5M  (BERT 骨干: 38.5M)
总训练步数: 1875  Warmup 步数: 187
Epoch 1/3 | train_loss=0.2744 | val_acc=0.7566 val_f1=0.7562 threshold=0.64 | 662s
  ✓ 新最优模型已保存 → /Users/zhouyang/myworkspace/badou-nlp/周扬/week08/不同数据集测试效果/文本匹配项目/bq_corpus/outputs/bq_corpus_checkpoints/biencoder_cosine_best.pt  (val_f1=0.7562)
Epoch 2/3 | train_loss=0.2180 | val_acc=0.7796 val_f1=0.7796 threshold=0.68 | 527s
  ✓ 新最优模型已保存 → /Users/zhouyang/myworkspace/badou-nlp/周扬/week08/不同数据集测试效果/文本匹配项目/bq_corpus/outputs/bq_corpus_checkpoints/biencoder_cosine_best.pt  (val_f1=0.7796)
Epoch 3/3 | train_loss=0.2017 | val_acc=0.7865 val_f1=0.7865 threshold=0.69 | 512s
  ✓ 新最优模型已保存 → /Users/zhouyang/myworkspace/badou-nlp/周扬/week08/不同数据集测试效果/文本匹配项目/bq_corpus/outputs/bq_corpus_checkpoints/biencoder_cosine_best.pt  (val_f1=0.7865)