周扬/week08/不同数据集测试效果/文本匹配项目/其他数据集试验/lcqmc集/biencoder_cosine_log.json

[
  {
    "epoch": 1,
    "train_loss": 0.25999016210420217,
    "val_acc": 0.7010425471963934,
    "val_f1": 0.7001911943890105,
    "threshold": 0.92,
    "elapsed_s": 572.556184053421
  },
  {
    "epoch": 2,
    "train_loss": 0.2099816594594049,
    "val_acc": 0.7135812905043675,
    "val_f1": 0.7134659121594613,
    "threshold": 0.88,
    "elapsed_s": 671.4602038860321
  },
  {
    "epoch": 3,
    "train_loss": 0.19490268208679865,
    "val_acc": 0.7102000563539025,
    "val_f1": 0.7099960415713217,
    "threshold": 0.91,
    "elapsed_s": 698.4825518131256
  }
]

周扬/week08/不同数据集测试效果/文本匹配项目/其他数据集试验/lcqmc集/BiEncoder-样本训练.md

# 训练结果：

构建模型...
Loading weights: 100%|█████████████████████████| 55/55 [00:00<00:00, 24346.88it/s]
模型: BiEncoder (pool=mean, layers=3)
参数量: 38.5M  (BERT 骨干: 38.5M)
总训练步数: 1767  Warmup 步数: 176
Epoch 1/3 | train_loss=0.2600 | val_acc=0.7010 val_f1=0.7002 threshold=0.92 | 573s
  ✓ 新最优模型已保存 → /Users/zhouyang/myworkspace/badou-nlp/周扬/week08/不同数据集测试效果/文本匹配项目/lcqmc/outputs/lcqmc_checkpoints/biencoder_cosine_best.pt  (val_f1=0.7002)
Epoch 2/3 | train_loss=0.2100 | val_acc=0.7136 val_f1=0.7135 threshold=0.88 | 671s
  ✓ 新最优模型已保存 → /Users/zhouyang/myworkspace/badou-nlp/周扬/week08/不同数据集测试效果/文本匹配项目/lcqmc/outputs/lcqmc_checkpoints/biencoder_cosine_best.pt  (val_f1=0.7135)
Epoch 3/3 | train_loss=0.1949 | val_acc=0.7102 val_f1=0.7100 threshold=0.91 | 698s